,Unnamed: 0,path,source_text,pred_text,ref_text,ASR_BLEU,COMET,METEOR,BLASER
224,224,common_voice_es_19669625.mp3,los valles en los alrededores son preciosos oasis del silencio llenos de riquezas naturales,the valleys and the rivers are precipitous wastes of silence full of natural richness,some of the surrounding hills and valleys offer wonderful quiet oasis filled with rich natural environments,BLEU = 3.68 35.7/3.8/2.1/1.1 (BP = 0.867 ratio = 0.875 hyp_len = 14 ref_len = 16),0.5517061352729797,0.189873417721519,3.9112801551818848
225,225,common_voice_es_19680098.mp3,aunque no se ha evidenciado alrededor del cerro,even if it is not evidence that the rear door of the tower,although there is no evidence around the hill,BLEU = 4.07 23.1/4.2/2.3/1.2 (BP = 1.000 ratio = 1.625 hyp_len = 13 ref_len = 8),0.5555115342140198,0.1764705882352941,3.2601091861724854
226,226,common_voice_es_19764491.mp3,a mamá y papá,mammon pop,to mummy and daddy,BLEU = 0.00 0.0/0.0/0.0/0.0 (BP = 0.368 ratio = 0.500 hyp_len = 2 ref_len = 4),0.3952680230140686,0.0,3.0689914226531982
227,227,common_voice_es_19092555.mp3,el brazo que se cansa ,brussels that can be found,the arm that gets tired,BLEU = 10.68 20.0/12.5/8.3/6.2 (BP = 1.000 ratio = 1.000 hyp_len = 5 ref_len = 5),0.36848363280296326,0.20000000000000004,2.9813997745513916
228,228,common_voice_es_19979737.mp3,ha pasado a la posteridad como el poeta de los banquetes,he has passed the posterity as the poet of the banquets,he is known as the poet of the feasts,BLEU = 36.72 54.5/40.0/33.3/25.0 (BP = 1.000 ratio = 1.222 hyp_len = 11 ref_len = 9),0.6608749628067017,0.7519964507542148,4.6500935554504395
229,229,common_voice_es_19142086.mp3,las mujeres especialmente entre las jóvenes empezaron a utilizar el paño africano como reivindicación,the women especially among the girls took part in using the african pamphlet as a rivet,women especially young ladies started to wear the african head ties as a symbol of their claim for recognition,BLEU = 7.02 37.5/20.0/3.6/1.9 (BP = 0.829 ratio = 0.842 hyp_len = 16 ref_len = 19),0.5238524079322815,0.3755848930481283,3.7134976387023926
230,230,common_voice_es_19746110.mp3,compuso tres óperas y un ballet y escribió libros para estudio musical,he composed three operas and a ballet and wrote books for musical study,he composed three operas and ballet and wrote books for music studies,BLEU = 57.84 76.9/66.7/54.5/40.0 (BP = 1.000 ratio = 1.083 hyp_len = 13 ref_len = 12),0.9421901702880859,0.9894398530762167,4.877125263214111
231,231,common_voice_es_19634834.mp3,en el debut en primera de los armeros siguió siendo el portero titular,the debut in the first of the armourers it was seen the title of the door,he remained as permanent goalkeeper in the eibar clubs first division debut,BLEU = 5.82 25.0/6.7/3.6/1.9 (BP = 1.000 ratio = 1.333 hyp_len = 16 ref_len = 12),0.39197513461112976,0.16129032258064518,3.380370855331421
232,232,common_voice_es_20008371.mp3,se encuentra enclavada al pie de la sierra de comechingones,it is located at the foot of the sierra de camacs,there at the bottom of the comechingones mountain range it is located,BLEU = 18.72 63.6/40.0/11.1/6.2 (BP = 0.913 ratio = 0.917 hyp_len = 11 ref_len = 12),0.729913055896759,0.565083176127594,3.445768356323242
233,233,common_voice_es_19614707.mp3,las funciones del sultán son las de un monarca absoluto,the functions of the sultan are the absolute monarch,the duties of a sultan are the same as an absolute monarch,BLEU = 17.39 77.8/37.5/14.3/8.3 (BP = 0.717 ratio = 0.750 hyp_len = 9 ref_len = 12),0.8461630344390869,0.5424733996162567,4.489816188812256
234,234,common_voice_es_19623899.mp3,además han grabado cinco recopilatorios,besides there are five recipes,besides they have recorded five compilations,BLEU = 10.40 40.0/12.5/8.3/6.2 (BP = 0.819 ratio = 0.833 hyp_len = 5 ref_len = 6),0.5725141763687134,0.1694915254237288,3.5425784587860107
235,235,common_voice_es_19138149.mp3,la idea del techo fue concebida como una membrana en colores naturales de seda,the idea of the tax was considered as a membrane in natural causes of seed,the original idea regarding the roof consisted in natural colored silk membrane,BLEU = 6.92 40.0/7.1/3.8/2.1 (BP = 1.000 ratio = 1.250 hyp_len = 15 ref_len = 12),0.4763917028903961,0.3466576332429991,3.546037197113037
236,236,common_voice_es_19674182.mp3,wolf ha estado en el espacio en cuatro ocasiones,wolfe has been in spain for years,wolf has been on the space in four occasions,BLEU = 10.92 42.9/16.7/10.0/6.2 (BP = 0.751 ratio = 0.778 hyp_len = 7 ref_len = 9),0.6650000810623169,0.42613636363636365,3.5426902770996094
237,237,common_voice_es_19764274.mp3,es protagonizada por claudia di girolamo francisco reyes y francisco melo,shes puritanized by cordelia de la romola francesco reis and francisco,claudia di girolamo francisco reyes and francisco melo had the leading roles,BLEU = 6.84 18.2/10.0/5.6/3.1 (BP = 0.913 ratio = 0.917 hyp_len = 11 ref_len = 12),0.5010964274406433,0.15756302521008406,2.6112239360809326
238,238,common_voice_es_19699996.mp3,el color puede variar desde blanco rosa verdoso y anaranjado,kullak can vary from white pink to red and orange,its color can range between white pink a little bit green and orange,BLEU = 9.30 50.0/22.2/6.2/3.6 (BP = 0.741 ratio = 0.769 hyp_len = 10 ref_len = 13),0.7741682529449463,0.35118110236220473,4.127630233764648
239,239,common_voice_es_19769376.mp3,algunos de los habitantes se establecieron en el monte athos,some of the inhabitants were established in the estuary,some of the inhabitants settled in mount athos,BLEU = 31.56 55.6/37.5/28.6/16.7 (BP = 1.000 ratio = 1.125 hyp_len = 9 ref_len = 8),0.7498043179512024,0.45925925925925926,3.5742480754852295
240,240,common_voice_es_19636463.mp3,santiago orígenes,santiago,santiago background,BLEU = 36.79 100.0/0.0/0.0/0.0 (BP = 0.368 ratio = 0.500 hyp_len = 1 ref_len = 2),0.9295106530189514,0.2631578947368421,3.775801181793213
241,241,common_voice_es_19151724.mp3,varios de ellos se quedaron en distintas ciudades del extranjero para completar su educación,several of them were buried in different cities of excavations or completing their education,several of them stayed in different foreign cities to complete their education,BLEU = 16.06 57.1/30.8/8.3/4.5 (BP = 1.000 ratio = 1.167 hyp_len = 14 ref_len = 12),0.49637773633003235,0.6284153005464481,3.688603401184082
242,242,common_voice_es_18353546.mp3,que le den por saco a todo,you want to do anything,fuck everything,BLEU = 0.00 0.0/0.0/0.0/0.0 (BP = 1.000 ratio = 2.500 hyp_len = 5 ref_len = 2),0.437054306268692,0.0,3.156750440597534
243,243,common_voice_es_19736448.mp3,la dieta de esta especie es desconocida pero probablemente consuma lagartijas y pequeñas serpientes,diet of this species is disconcerting but it is probably prohibited by small species,this type of diet is unknown but probably he eats lizards and small serpents,BLEU = 4.62 50.0/3.8/2.1/1.1 (BP = 1.000 ratio = 1.000 hyp_len = 14 ref_len = 14),0.6405271887779236,0.25,3.502918243408203
244,244,common_voice_es_19716931.mp3,el personaje está basado en la figura de iago solla garcía,the cactus is based on the figure of the lobes oligarchia,the character is based on iago solla garcía,BLEU = 14.99 36.4/20.0/11.1/6.2 (BP = 1.000 ratio = 1.375 hyp_len = 11 ref_len = 8),0.44420093297958374,0.4518072289156627,3.113253593444824
245,245,common_voice_es_19634045.mp3,completos genocidios fruto de la obediencia del pueblo hebreo a un mandato divino,plea genesis the fruit of the obesity of the hebrides phoebus to a divine mandate,complete genocide fruit of obedience of the hebrew people to a divine mandate,BLEU = 22.23 53.3/35.7/15.4/8.3 (BP = 1.000 ratio = 1.154 hyp_len = 15 ref_len = 13),0.42135030031204224,0.5900804924242424,2.921816825866699
246,246,common_voice_es_20003310.mp3,abandonó la empresa al año siguiente por mala salud,they abandoned the company the following year for good health,they left the company the following year due to their bad health condition,BLEU = 31.65 70.0/44.4/37.5/28.6 (BP = 0.741 ratio = 0.769 hyp_len = 10 ref_len = 13),0.7693219780921936,0.5294873855053832,4.512857913970947
247,247,common_voice_es_19604075.mp3,hay muchas ruinas griegas en la provincia,there are many greeks in the province,the province has many greek ruins,BLEU = 14.54 42.9/16.7/10.0/6.2 (BP = 1.000 ratio = 1.167 hyp_len = 7 ref_len = 6),0.7449843883514404,0.6147540983606558,4.025062084197998
248,248,common_voice_es_18362180.mp3,alguien vendrá que bueno te hará,ill come back to you again,the grass always looks greener on the other side,BLEU = 0.00 0.0/0.0/0.0/0.0 (BP = 0.607 ratio = 0.667 hyp_len = 6 ref_len = 9),0.3504057824611664,0.0,3.0096993446350098
249,249,common_voice_es_19609792.mp3,mistress anunció un reencuentro para un último concierto en el damnation festival,sisters announced a meeting for the last concert in the domination festival,mistress announced a reunion at the last concert at the damnation festival,BLEU = 17.24 58.3/27.3/10.0/5.6 (BP = 1.000 ratio = 1.000 hyp_len = 12 ref_len = 12),0.6860508322715759,0.5289115646258503,3.9355483055114746
250,250,common_voice_es_19638354.mp3,es el único pueblo rural de santa fe declarado monumento histórico,it is the only real village of santa fe declared historical monument,it is the only rural village of santa fe that was declared a historical monument,BLEU = 37.16 91.7/63.6/40.0/22.2 (BP = 0.779 ratio = 0.800 hyp_len = 12 ref_len = 15),0.8785737156867981,0.7303086523865745,4.649399280548096
251,251,common_voice_es_19722758.mp3,pilsen representa el paradigma del gusto uruguayo de la cerveza,hilson represents the paradise of the iroquois of the service,pilsen represents the paradigm of the uruguayan taste for beer,BLEU = 11.87 40.0/22.2/6.2/3.6 (BP = 1.000 ratio = 1.000 hyp_len = 10 ref_len = 10),0.4215342700481415,0.31562500000000004,2.49971342086792
252,252,common_voice_es_19639811.mp3,los materiales de fabricación varían enormemente,fabrication materials very enormously,the manufacturing resources range widely,BLEU = 0.00 0.0/0.0/0.0/0.0 (BP = 0.779 ratio = 0.800 hyp_len = 4 ref_len = 5),0.6469359993934631,0.0,4.159379959106445
253,253,common_voice_es_19596475.mp3,su cabecera es santa maría,capitol santa maria,santa maria is its main district,BLEU = 20.25 66.7/50.0/50.0/0.0 (BP = 0.368 ratio = 0.500 hyp_len = 3 ref_len = 6),0.6604811549186707,0.3289473684210526,3.5196964740753174
254,254,common_voice_es_19373803.mp3,él ha regresado a los ángeles en forma temporal para cuidar a su madre,he arrived at los angeles in the shape of a season for his mother,he has temporarily come back to los angeles in order to look after his mother,BLEU = 12.95 42.9/23.1/8.3/4.5 (BP = 0.931 ratio = 0.933 hyp_len = 14 ref_len = 15),0.5822134613990784,0.37751677852349,3.6346280574798584
255,255,common_voice_es_20050452.mp3,en ella publicarían todos los futuros autores en corso como petru rocca,they published all the authors in courses such as patriarch,all future corsican writers would publish in it such as petru rocca,BLEU = 8.17 40.0/11.1/6.2/3.6 (BP = 0.819 ratio = 0.833 hyp_len = 10 ref_len = 12),0.521187961101532,0.36134651600753287,3.0875401496887207
256,256,common_voice_es_18598259.mp3,antes de que aprenda a montar en bicicleta,once they are ready they will go to the castle,before i learn to ride a bike,BLEU = 4.20 10.0/5.6/3.1/1.8 (BP = 1.000 ratio = 1.429 hyp_len = 10 ref_len = 7),0.41464945673942566,0.0684931506849315,2.4077842235565186
257,257,common_voice_es_19979610.mp3,sus tallos son enredados con pelos cortos y suaves cuando son jóvenes,stales are reddish with short hairs and lice when they are young,its stems are tangled with short soft hair when they are young,BLEU = 26.20 58.3/36.4/20.0/11.1 (BP = 1.000 ratio = 1.000 hyp_len = 12 ref_len = 12),0.5312227606773376,0.625,3.546372652053833
258,258,common_voice_es_19608243.mp3,está representada principalmente por la actividad comercial menor construcción servicios turismo menor entre otros,is mainly represented by the commercial activity construction services terrestrial men are among others,its main activities include minor trade construction services and small scale tourism among others,BLEU = 8.03 28.6/15.4/4.2/2.3 (BP = 1.000 ratio = 1.000 hyp_len = 14 ref_len = 14),0.5223453640937805,0.31857142857142856,3.855792999267578
259,259,common_voice_es_18312921.mp3,a cada cerdo le llega su san martín,he is kaido of the gods of saint martin,what goes around comes around,BLEU = 0.00 0.0/0.0/0.0/0.0 (BP = 1.000 ratio = 1.800 hyp_len = 9 ref_len = 5),0.2897478938102722,0.0,2.7142221927642822
260,260,common_voice_es_20015089.mp3,el toyota no,to tell you to know,not the toyota,BLEU = 0.00 0.0/0.0/0.0/0.0 (BP = 1.000 ratio = 1.667 hyp_len = 5 ref_len = 3),0.3496514856815338,0.0,2.5274951457977295
261,261,common_voice_es_19749759.mp3,este tipo de construcción hace que la válvula tenga un precio reducido,type of construction does not mean that the valve has a reduced price,this type of construction makes that the valve has a lower price,BLEU = 39.83 69.2/50.0/36.4/20.0 (BP = 1.000 ratio = 1.083 hyp_len = 13 ref_len = 12),0.8287753462791443,0.7300275482093663,4.636448383331299
262,262,common_voice_es_19764968.mp3,el plan se elaboró en absoluto secreto,the plan worked and the obsolete,a strict secret the plan was made through,BLEU = 11.63 33.3/20.0/12.5/8.3 (BP = 0.717 ratio = 0.750 hyp_len = 6 ref_len = 8),0.5241281986236572,0.12820512820512822,3.2702527046203613
263,263,common_voice_es_19725428.mp3,ahora la única salida que le queda es convertirse en entrenador,the only solid that they want is to become a trainer,now the only way out is to become a coach,BLEU = 27.90 54.5/40.0/22.2/12.5 (BP = 1.000 ratio = 1.100 hyp_len = 11 ref_len = 10),0.6182387471199036,0.5830583058305829,3.527015209197998
264,264,common_voice_es_19598342.mp3,gana el equipo que consiga mayor puntuación,hanna the team that has made your plantation,the team getting the highest score wins,BLEU = 11.04 25.0/14.3/8.3/5.0 (BP = 1.000 ratio = 1.143 hyp_len = 8 ref_len = 7),0.36707332730293274,0.2112676056338028,2.297459840774536
265,265,common_voice_es_19660292.mp3,dichos cuadros se vendieron en su totalidad,these four were lost in their totality,those pictures were totally sold,BLEU = 6.57 14.3/8.3/5.0/3.1 (BP = 1.000 ratio = 1.400 hyp_len = 7 ref_len = 5),0.5494453310966492,0.19230769230769232,3.328096866607666
266,266,common_voice_es_19982064.mp3,la línea finalmente se convirtió en una red de radares,the line finally became a line of raiders,the line eventually was converted into a radar network,BLEU = 10.79 37.5/14.3/8.3/5.0 (BP = 0.882 ratio = 0.889 hyp_len = 8 ref_len = 9),0.6151887774467468,0.16853932584269662,3.782942771911621
267,267,common_voice_es_19639060.mp3,se encuentra al sur de nueva caledonia,is located in the south of new caledonia,you can find it in the south of new caledonia,BLEU = 52.99 75.0/71.4/66.7/60.0 (BP = 0.779 ratio = 0.800 hyp_len = 8 ref_len = 10),0.9020811915397644,0.6108276643990929,4.404195785522461
268,268,common_voice_es_19755901.mp3,en esta escena su cabello está rizado y utiliza unos lentes de sol,this scene has had a shape and uses the sole link,in this scene their hair is curled and they are wearing sunglasses,BLEU = 7.57 27.3/10.0/5.6/3.1 (BP = 0.913 ratio = 0.917 hyp_len = 11 ref_len = 12),0.41082289814949036,0.21475256769374415,2.760547161102295
269,269,common_voice_es_19654102.mp3,en la isla se encuentra una población de árboles de diferentes especies,yes and there is a population of different species,the island has a population of different tree species,BLEU = 31.56 55.6/37.5/28.6/16.7 (BP = 1.000 ratio = 1.000 hyp_len = 9 ref_len = 9),0.6917579770088196,0.5377777777777778,3.4216959476470947
270,270,common_voice_es_19666689.mp3,moose recibe un beso de sophie lo cual lo deja sorprendido,i wish to see zobeide sophie the one who is surprised,sophie gives moose a kiss which takes him by surprise,BLEU = 3.75 9.1/5.0/2.8/1.6 (BP = 1.000 ratio = 1.100 hyp_len = 11 ref_len = 10),0.455445796251297,0.09900990099009903,3.14700984954834
271,271,common_voice_es_19637065.mp3,la película ganó premios en edimburgo bratislava y filadelfia,movie one prizes in edinburgh or sylvania,the movie won awards in edinburgh bratislava and philadelphia,BLEU = 10.92 42.9/16.7/10.0/6.2 (BP = 0.751 ratio = 0.778 hyp_len = 7 ref_len = 9),0.5457164645195007,0.42613636363636365,3.5744950771331787
272,272,common_voice_es_19746705.mp3,se tituló posteriormente de ingeniero agrónomo en la universidad de chile,later studied economy at the university,he was then granted the degree of agronomist by the university of chile,BLEU = 5.06 33.3/20.0/12.5/8.3 (BP = 0.311 ratio = 0.462 hyp_len = 6 ref_len = 13),0.5703668594360352,0.1524390243902439,3.5140140056610107
273,273,common_voice_es_19670098.mp3,san buenaventura fue sin duda el personaje más notable de la asamblea,and buenaventura was the most notable person of the assembly,saint buenaventura was without a doubt the most remarkable character in the assembly,BLEU = 10.77 60.0/33.3/6.2/3.6 (BP = 0.741 ratio = 0.769 hyp_len = 10 ref_len = 13),0.7556881904602051,0.4429133858267717,4.063381195068359
274,274,common_voice_es_19768770.mp3,una vez seguro el tío david le dice a ray sobre la colonia,unfortunately the same year it is said that they live only in the colony,once safe uncle david tells ray about the colony,BLEU = 5.68 14.3/7.7/4.2/2.3 (BP = 1.000 ratio = 1.556 hyp_len = 14 ref_len = 9),0.3764056861400604,0.2690058479532164,2.6505544185638428
275,275,common_voice_es_19631977.mp3,el siguiente diagrama muestra a las localidades en un radio de de south sumter,the following diagram shows the locations in a cylinder radio,the following diagram shows the towns in a radius of blank from south sumter,BLEU = 30.29 70.0/55.6/37.5/28.6 (BP = 0.670 ratio = 0.714 hyp_len = 10 ref_len = 14),0.5325977206230164,0.508703481392557,3.751633882522583
276,276,common_voice_es_19747516.mp3,aquellos que no lo hagan perderán su afiliación a la entidad,you dont like them will you,those who wont do it will lose the membership to the entity,BLEU = 2.99 16.7/10.0/6.2/4.2 (BP = 0.368 ratio = 0.500 hyp_len = 6 ref_len = 12),0.44329869747161865,0.043859649122807015,2.3905258178710938
277,277,common_voice_es_19971193.mp3,lotta es el personaje de que menos se sabe,what is the person that is better known,lotta is the character we least know about,BLEU = 11.04 25.0/14.3/8.3/5.0 (BP = 1.000 ratio = 1.000 hyp_len = 8 ref_len = 8),0.6107023358345032,0.1875,3.056344985961914
278,278,common_voice_es_19124904.mp3,la economía de la pintada está basada en la producción del famoso sombrero panamá,the economy of the painting is based on the production of the famous sombrero panama,the economy of the pintada is based on the production of the famous panama hat,BLEU = 66.06 86.7/71.4/61.5/50.0 (BP = 1.000 ratio = 1.000 hyp_len = 15 ref_len = 15),0.7508984208106995,0.8613412228796845,3.9182639122009277
279,279,common_voice_es_19663570.mp3,nació en oak park illinois pero fue criada en california,he was born in new york but was born in california,she was born in oak park illinois but she was raised in california,BLEU = 15.91 63.6/30.0/11.1/6.2 (BP = 0.834 ratio = 0.846 hyp_len = 11 ref_len = 13),0.7359433770179749,0.3746811224489796,3.3783490657806396
280,280,common_voice_es_20061143.mp3,sin embargo más tarde lo aceptaron y la han apoyado desde entonces al respecto,however more often they accepted and they have been called from then on to respect,later on of course they agreed to it and they have been backing her ever since in this matter,BLEU = 14.49 46.7/21.4/15.4/8.3 (BP = 0.766 ratio = 0.789 hyp_len = 15 ref_len = 19),0.6106500029563904,0.34123326750054855,3.7717020511627197
281,281,common_voice_es_19608394.mp3,el misterioso dueño y encargado de la tienda,the mysterious dorani karma of the tinta,the mysterious owner and manager of the shop,BLEU = 16.10 57.1/33.3/10.0/6.2 (BP = 0.867 ratio = 0.875 hyp_len = 7 ref_len = 8),0.4497610330581665,0.4746835443037974,3.072326183319092
282,282,common_voice_es_19706027.mp3,músicos adicionales,original music,additional musicians,BLEU = 0.00 0.0/0.0/0.0/0.0 (BP = 1.000 ratio = 1.000 hyp_len = 2 ref_len = 2),0.7178024053573608,0.0,3.9526216983795166
283,283,common_voice_es_19659732.mp3,arreglo de cuerdas sergio tilo gonzález,ecco di cortis sergia theodora ponza,string arrangement sergio tilo gonzalez,BLEU = 0.00 0.0/0.0/0.0/0.0 (BP = 1.000 ratio = 1.200 hyp_len = 6 ref_len = 5),0.5074599385261536,0.0,3.0936803817749023
284,284,common_voice_es_19657874.mp3,navegó a cuba con doscientos hombres sin decirles nunca el objetivo de su viaje,a vega cuba with two hundred men without deciding on the objective of his trip,he sailed to cuba with two hundred men without ever telling them the purpose of the journey,BLEU = 30.45 53.3/35.7/30.8/25.0 (BP = 0.875 ratio = 0.882 hyp_len = 15 ref_len = 17),0.6339448094367981,0.4636346726190477,3.841876745223999
285,285,common_voice_es_19748032.mp3,el mejor preseleccionado albergó cada partido,best selling member one every,the top ranking team was the host of each game,BLEU = 0.00 0.0/0.0/0.0/0.0 (BP = 0.368 ratio = 0.500 hyp_len = 5 ref_len = 10),0.41500914096832275,0.0,3.3440544605255127
286,286,common_voice_es_19646381.mp3,con el advenimiento de la computación los cálculos pudieron hacerse a altas velocidades,with the advent of the computation the calculus had to be high velocities,with the introduction of computers calculations could be made at high speeds,BLEU = 7.77 38.5/8.3/4.5/2.5 (BP = 1.000 ratio = 1.083 hyp_len = 13 ref_len = 12),0.7410392761230469,0.24793388429752067,3.858304262161255
287,287,common_voice_es_19691743.mp3,cuenta con una tribuna techada y asientos preferenciales,he has attacked tribunes and preferences,it offers a roofed grandstand and preferential seats,BLEU = 5.82 16.7/10.0/6.2/4.2 (BP = 0.717 ratio = 0.750 hyp_len = 6 ref_len = 8),0.4902913570404053,0.06410256410256411,2.9860501289367676
288,288,common_voice_es_18309900.mp3,a mi me gustan mucho los perros,for me i like many fishes,i dont like dogs so much,BLEU = 9.65 33.3/10.0/6.2/4.2 (BP = 1.000 ratio = 1.000 hyp_len = 6 ref_len = 6),0.5099992156028748,0.16666666666666666,3.7062742710113525
289,289,common_voice_es_19602997.mp3,la feria de villaseca es una celebración de linares,the villa sicca is the celebration of lenos,villaseca fair is a festivity held in linares city,BLEU = 4.87 12.5/7.1/4.2/2.5 (BP = 0.882 ratio = 0.889 hyp_len = 8 ref_len = 9),0.5875796675682068,0.05617977528089887,3.1729588508605957
290,290,common_voice_es_19597925.mp3,son plantas herbáceas epífitas rastreras,they are herbaceous herbaceous plants or strawberries,they are epiphyte creeping herbaceous plants,BLEU = 18.58 57.1/33.3/10.0/6.2 (BP = 1.000 ratio = 1.167 hyp_len = 7 ref_len = 6),0.5289744734764099,0.6147540983606558,3.4468750953674316
291,291,common_voice_es_19702562.mp3,estaba construido enteramente de duraluminio con recubrimiento de tela,it was built entirely of duration and with tolerable completion,along with a cloth covering it is purely built on duralumin,BLEU = 5.00 30.0/5.6/3.1/1.8 (BP = 0.905 ratio = 0.909 hyp_len = 10 ref_len = 11),0.4185648560523987,0.13761467889908252,3.206646203994751
292,292,common_voice_es_19721680.mp3,sin embargo singh thapa demasiado confiado de su poder no le hizo caso,however since zeppas tenaciously confiscated of his power did not leave the house,however singh thapa too confident of his power he didnt payed attention to him,BLEU = 11.44 30.8/16.7/9.1/5.0 (BP = 0.926 ratio = 0.929 hyp_len = 13 ref_len = 14),0.5515762567520142,0.2697841726618705,3.1360433101654053
293,293,common_voice_es_20028656.mp3,en otras divisiones usadas abruzos y molise son parte del centro,the other uses divisions bruises and mollia part of the centre,in other common administrative divisions abruzzi and molise form part of the center,BLEU = 13.83 54.5/20.0/11.1/6.2 (BP = 0.834 ratio = 0.846 hyp_len = 11 ref_len = 13),0.4483914077281952,0.3993055555555555,3.59071946144104
294,294,common_voice_es_19999435.mp3,su muerte fue atribuida a causas naturales,his death was attributed to natural causes,his her death was due to natural causes,BLEU = 27.89 85.7/50.0/20.0/12.5 (BP = 0.867 ratio = 0.875 hyp_len = 7 ref_len = 8),0.9252544045448303,0.7120253164556962,4.680749893188477
295,295,common_voice_es_19284434.mp3,la pintura además celebra el tema de la castidad,painting is also celebrating the theme of the cast,painting also praises chastity,BLEU = 5.67 22.2/6.2/3.6/2.1 (BP = 1.000 ratio = 2.250 hyp_len = 9 ref_len = 4),0.574031412601471,0.22222222222222224,3.893991470336914
296,296,common_voice_es_19414077.mp3,se encuentra en la parte occidental de la ciudad de puerto cabello,is located in the accidental part of the city of puerto cabello,its found in the western part of the city of hair port,BLEU = 36.46 58.3/45.5/30.0/22.2 (BP = 1.000 ratio = 1.000 hyp_len = 12 ref_len = 12),0.659470796585083,0.576530612244898,3.6707162857055664
297,297,common_voice_es_19148091.mp3,en la misma universidad impartió cursos de doctorado sobre la novela de caballería bizantina,in the same university he started teaching about the novel of byzantine history,they gave p h d training courses on the byzantine cavalry novel at the same university,BLEU = 10.86 46.2/16.7/9.1/5.0 (BP = 0.794 ratio = 0.812 hyp_len = 13 ref_len = 16),0.6721627116203308,0.27158527954706296,4.258753776550293
298,298,common_voice_es_19673438.mp3,necesito que cortar los fideos,ay to cut the ides,i need to cut the noodles,BLEU = 32.56 60.0/50.0/33.3/25.0 (BP = 0.819 ratio = 0.833 hyp_len = 5 ref_len = 6),0.5353375673294067,0.4990583804143125,2.881181240081787
