,Unnamed: 0,path,source_text,pred_text,ref_text,ASR_BLEU,COMET,METEOR,BLASER
747,747,common_voice_es_19598304.mp3,los jugadores así lo contaba silvera prácticamente no dormían,plays as they were talking to sylvana were particularly stormy,as silvera described the players practically didnt sleep,BLEU = 4.20 10.0/5.6/3.1/1.8 (BP = 1.000 ratio = 1.250 hyp_len = 10 ref_len = 8),0.47700387239456177,0.06097560975609756,3.136706590652466
748,748,common_voice_es_19672765.mp3,hicieron que se sientan más como una familia,they found that they were more like a family,they made them feel like family,BLEU = 6.27 33.3/6.2/3.6/2.1 (BP = 1.000 ratio = 1.500 hyp_len = 9 ref_len = 6),0.8619163632392883,0.3174603174603175,4.557319641113281
749,749,common_voice_es_19627686.mp3,la radio quedó así totalmente privatizada,the radio was completely privateized,the radio was thus totally privatized,BLEU = 32.56 60.0/50.0/33.3/25.0 (BP = 0.819 ratio = 0.833 hyp_len = 5 ref_len = 6),0.8768631815910339,0.635593220338983,4.301136493682861
750,750,common_voice_es_19695738.mp3,el lago es de difícil acceso,the water is a difficult access,the lake doesnt have easy access,BLEU = 9.65 33.3/10.0/6.2/4.2 (BP = 1.000 ratio = 1.000 hyp_len = 6 ref_len = 6),0.7783206105232239,0.16666666666666666,4.344955921173096
751,751,common_voice_es_18751722.mp3,más vale prevenir que curar,better to prevent it than cure it,prevention is better than cure,BLEU = 14.54 42.9/16.7/10.0/6.2 (BP = 1.000 ratio = 1.400 hyp_len = 7 ref_len = 5),0.8428301215171814,0.6069711538461539,4.275073528289795
752,752,common_voice_es_19763680.mp3,la idea del video fue de pauli guitarrista de la banda,the idea of the villiers porpoise cataract of the band,the videos idea was from pauli guitarist of the band,BLEU = 17.75 50.0/22.2/12.5/7.1 (BP = 1.000 ratio = 1.000 hyp_len = 10 ref_len = 10),0.3861774504184723,0.446,2.8977622985839844
753,753,common_voice_es_19637711.mp3,sin embargo continua su actividad con normalidad,however he continued his activity with narcisse,despite this it continues the activity,BLEU = 6.57 14.3/8.3/5.0/3.1 (BP = 1.000 ratio = 1.167 hyp_len = 7 ref_len = 6),0.5220150351524353,0.1639344262295082,3.75199818611145
754,754,common_voice_es_19759688.mp3,la multiplicación bacteriana puede seguir durante generaciones sin que el virus se manifieste,bacterium multiplication can be followed during generations since the virus is manifested,the bacterial multiplication can continue for generations without the virus been manifested,BLEU = 10.60 50.0/18.2/5.0/2.8 (BP = 1.000 ratio = 1.000 hyp_len = 12 ref_len = 12),0.8166860342025757,0.42592592592592593,4.289432525634766
755,755,common_voice_es_19604965.mp3,en los lugares húmedos,in the summer places,in humid places,BLEU = 19.00 50.0/16.7/12.5/12.5 (BP = 1.000 ratio = 1.333 hyp_len = 4 ref_len = 3),0.6137140989303589,0.32258064516129037,3.8254165649414062
756,756,common_voice_es_19627812.mp3,algunas de sus obras fueron cabezas,some of his works were great,some of his works were leading,BLEU = 75.98 83.3/80.0/75.0/66.7 (BP = 1.000 ratio = 1.000 hyp_len = 6 ref_len = 6),0.788932740688324,0.8300000000000002,3.8809738159179688
757,757,common_voice_es_19135360.mp3,un aspecto importante de las correas para perros es su robustez,an important aspect of the careers for paris is their robustness,an important aspect of dog leashes is their sturdiness,BLEU = 27.90 54.5/40.0/22.2/12.5 (BP = 1.000 ratio = 1.222 hyp_len = 11 ref_len = 9),0.4997745454311371,0.6400966183574879,3.368476629257202
758,758,common_voice_es_19765106.mp3,las cobras del noroeste de áfrica pueden ser totalmente negras,the covers of northeast africa can be totally black,cobras in the northwest of africa can be fully black,BLEU = 18.89 66.7/25.0/14.3/8.3 (BP = 0.895 ratio = 0.900 hyp_len = 9 ref_len = 10),0.7122354507446289,0.5162738496071829,3.887373447418213
759,759,common_voice_es_19746694.mp3,maría está enterrada en la capilla de los orleans en dreux,maria is buried in the castle of the orleans,mary is buried in the new orleans chapel in dreux,BLEU = 28.24 55.6/37.5/28.6/16.7 (BP = 0.895 ratio = 0.900 hyp_len = 9 ref_len = 10),0.7799662947654724,0.3757575757575758,3.6318318843841553
760,760,common_voice_es_19134173.mp3,las primeras las realiza al oeste francia en la redacción del mans,the first ones are made to the east of france in the reduction of france,they made the first ones on the west of france at mans newsroom,BLEU = 13.38 46.7/21.4/7.7/4.2 (BP = 1.000 ratio = 1.154 hyp_len = 15 ref_len = 13),0.5381432175636292,0.4336734693877551,3.3028531074523926
761,761,common_voice_es_19636502.mp3,dirigió una división durante la batalla de shiloh,he directed a division during the battle of shiloh,he commanded a unit during the battle of shiloh,BLEU = 48.55 77.8/50.0/42.9/33.3 (BP = 1.000 ratio = 1.000 hyp_len = 9 ref_len = 9),0.9344457983970642,0.7471655328798186,4.923431873321533
762,762,common_voice_es_19776777.mp3,las flores son de color rosa o púrpura,flowers are pink or purple,its flowers are pink or purple,BLEU = 81.87 100.0/100.0/100.0/100.0 (BP = 0.819 ratio = 0.833 hyp_len = 5 ref_len = 6),0.9647976756095886,0.8440677966101694,4.817130088806152
763,763,common_voice_es_19666481.mp3,una gran cantidad de músicos han estudiado en esta academia desde entonces,great song of music has been in this academy since then,a great number of musicians have studied in this academy since then,BLEU = 34.85 63.6/40.0/33.3/25.0 (BP = 0.913 ratio = 0.917 hyp_len = 11 ref_len = 12),0.7006797194480896,0.565083176127594,3.539216995239258
764,764,common_voice_es_19607017.mp3,continúa siendo una corporación familiar y privada,he continued a familiar and private corporation,it is still a family private corporation,BLEU = 14.54 42.9/16.7/10.0/6.2 (BP = 1.000 ratio = 1.000 hyp_len = 7 ref_len = 7),0.7541197538375854,0.3650793650793651,4.187193393707275
765,765,common_voice_es_19602741.mp3,es el primer faraón de origen libio en egipto,this is the first paragon of the origin of the libyana,hes the first libyan pharaoh in egypt,BLEU = 7.50 18.2/10.0/5.6/3.1 (BP = 1.000 ratio = 1.571 hyp_len = 11 ref_len = 7),0.5955273509025574,0.13513513513513514,3.4675188064575195
766,766,common_voice_es_19693788.mp3,la niña fue devuelta a su familia no así el niño nacido en cautiverio,the girl was raised to a family but she was born in cotiberia,the little girl was returned to her family but not the little boy born in captivity,BLEU = 9.13 61.5/25.0/4.5/2.5 (BP = 0.794 ratio = 0.812 hyp_len = 13 ref_len = 16),0.5193349123001099,0.4020700636942675,3.0867276191711426
767,767,common_voice_es_20012489.mp3,son muy atractivas para la abejas que realizan la polinización,they are very attractive for the adages that realize the polynesian,they are very attractive for the bees that make the pollination,BLEU = 49.62 72.7/50.0/44.4/37.5 (BP = 1.000 ratio = 1.000 hyp_len = 11 ref_len = 11),0.46875452995300293,0.7080965909090909,3.0228610038757324
768,768,common_voice_es_19628494.mp3,la capital histórica de la región es novo mesto,the historic capital of the region is nova mesa,the historical capital of the region is novo mesto,BLEU = 46.71 66.7/50.0/42.9/33.3 (BP = 1.000 ratio = 1.000 hyp_len = 9 ref_len = 9),0.9072473645210266,0.7766439909297052,4.1633734703063965
769,769,common_voice_es_19717504.mp3,mañana más y mejor,one on em more and better,tomorrow more and better,BLEU = 30.21 50.0/40.0/25.0/16.7 (BP = 1.000 ratio = 1.500 hyp_len = 6 ref_len = 4),0.5464067459106445,0.701058201058201,3.2454535961151123
770,770,common_voice_es_18862743.mp3,en mi camarote vale ,in my room please,in my cabinet o k,BLEU = 24.88 50.0/33.3/25.0/25.0 (BP = 0.779 ratio = 0.800 hyp_len = 4 ref_len = 5),0.6880657076835632,0.38265306122448983,3.349982976913452
771,771,common_voice_es_20012026.mp3,elia en alaska,elaine alas,elia in alaska,BLEU = 0.00 0.0/0.0/0.0/0.0 (BP = 0.607 ratio = 0.667 hyp_len = 2 ref_len = 3),0.6266363263130188,0.0,3.441798210144043
772,772,common_voice_es_19719808.mp3,la seguridad en el complejo fue extremada durante el evento,his security in the complex was extreme during the event,complex security was maximized during the event,BLEU = 18.58 60.0/22.2/12.5/7.1 (BP = 1.000 ratio = 1.429 hyp_len = 10 ref_len = 7),0.8761699199676514,0.700152207001522,4.41005802154541
773,773,common_voice_es_19637488.mp3,ese mismo año ganó sus primeras carreras profesionales en la carretera,that same year he won his first professional career in the corridor,he won his first professional races on the road that same year,BLEU = 43.67 75.0/54.5/40.0/22.2 (BP = 1.000 ratio = 1.000 hyp_len = 12 ref_len = 12),0.6730808615684509,0.7361111111111112,3.8161675930023193
774,774,common_voice_es_19667692.mp3,a su retorno al país se reincorpora a la vida sindical y política,with its return to the country it incorporates the political and political life,on his return to the country hell rejoin the union and political life,BLEU = 28.92 61.5/41.7/27.3/10.0 (BP = 1.000 ratio = 1.000 hyp_len = 13 ref_len = 13),0.7264724373817444,0.5991586538461539,3.780276298522949
775,775,common_voice_es_18499985.mp3,no te das cuenta pero te utiliza,i want you to know that he is it,you dont realize it but hes using you,BLEU = 5.67 22.2/6.2/3.6/2.1 (BP = 1.000 ratio = 1.125 hyp_len = 9 ref_len = 8),0.4806337356567383,0.1851851851851852,2.933814764022827
776,776,common_voice_es_19628271.mp3,es el contenido descargable para rock band otra serie de videojuegos de música,is the content of the discarded bourgeois band another series of idioms of music,its the downloadable content for rock band another series of music videogames,BLEU = 21.97 50.0/30.8/16.7/9.1 (BP = 1.000 ratio = 1.167 hyp_len = 14 ref_len = 12),0.499263197183609,0.5202408832385413,3.2304301261901855
777,777,common_voice_es_19701315.mp3,le acompañaban su esposa y sus hijos menores,they accompanied their husband and their daughters,his wife and younger children kept him company,BLEU = 5.69 14.3/8.3/5.0/3.1 (BP = 0.867 ratio = 0.875 hyp_len = 7 ref_len = 8),0.662484347820282,0.06329113924050632,3.78808856010437
778,778,common_voice_es_19639984.mp3,las fronteras del desierto están muy vagamente definidas,the borders of the desert are very vaguely defined,the desserts borders are barely defined,BLEU = 6.74 44.4/6.2/3.6/2.1 (BP = 1.000 ratio = 1.500 hyp_len = 9 ref_len = 6),0.8392351269721985,0.3174603174603175,5.108602523803711
779,779,common_voice_es_19654672.mp3,tiene manchas grandes por debajo de la sutura,his big hands on the back of the chair,there are large spots underneath the suture,BLEU = 4.77 11.1/6.2/3.6/2.1 (BP = 1.000 ratio = 1.286 hyp_len = 9 ref_len = 7),0.4204729497432709,0.06944444444444445,2.7943246364593506
780,780,common_voice_es_19009516.mp3,todo tuyo gracias ,everything thank you,all yours thank you,BLEU = 39.43 66.7/50.0/50.0/0.0 (BP = 0.717 ratio = 0.750 hyp_len = 3 ref_len = 4),0.8360934853553772,0.48076923076923084,3.869647264480591
781,781,common_voice_es_19061322.mp3,miramos los corrales donde mugen las vacas,look at the corners where the backs move,we are now watching the pens where cows go moo,BLEU = 5.11 25.0/7.1/4.2/2.5 (BP = 0.779 ratio = 0.800 hyp_len = 8 ref_len = 10),0.4533178508281708,0.1530612244897959,3.0294482707977295
782,782,common_voice_es_19608779.mp3,su hábitat natural son los bosques tropicales de java,its natural habitat are tropical forests,the tropical forests of java are their natural habitat,BLEU = 14.72 83.3/40.0/12.5/8.3 (BP = 0.607 ratio = 0.667 hyp_len = 6 ref_len = 9),0.9115294218063354,0.5126436781609196,4.312376976013184
783,783,common_voice_es_19121661.mp3,ella ha participado en varias producciones teatrales desde que tenía doce años,she has participated in several feats of production since she had twelve years,she has taken part in several theatre productions since she was twelve years old,BLEU = 11.44 61.5/33.3/4.5/2.5 (BP = 0.926 ratio = 0.929 hyp_len = 13 ref_len = 14),0.7568387985229492,0.6190603073097078,4.457631587982178
784,784,common_voice_es_19638749.mp3,andy nació y creció en nueva jersey,he was born and grew up in new jersey,andy was born and grew up in new jersey,BLEU = 86.33 88.9/87.5/85.7/83.3 (BP = 1.000 ratio = 1.000 hyp_len = 9 ref_len = 9),0.9532508850097656,0.8880208333333333,3.880903482437134
785,785,common_voice_es_19745797.mp3,realizó tareas de docencia en varias universidades,he studied law in several universities,performed educational duties at various universities,BLEU = 8.12 16.7/10.0/6.2/4.2 (BP = 1.000 ratio = 1.000 hyp_len = 6 ref_len = 6),0.6904457211494446,0.08333333333333333,4.2198567390441895
786,786,common_voice_es_19655461.mp3,recibió una educación judía ortodoxa,he received an orthodox education,it was educated as an orthodox jew,BLEU = 14.32 40.0/25.0/16.7/12.5 (BP = 0.670 ratio = 0.714 hyp_len = 5 ref_len = 7),0.8051717877388,0.3758169934640523,4.375255584716797
787,787,common_voice_es_19721457.mp3,juega de defensor en talleres de perico,he was a defender of prussia,he is a defenseman at talleres de perico sports club,BLEU = 4.96 33.3/10.0/6.2/4.2 (BP = 0.513 ratio = 0.600 hyp_len = 6 ref_len = 10),0.5267249941825867,0.10416666666666666,2.6968765258789062
788,788,common_voice_es_19943322.mp3,los otros miembros adultos de la expedición aparentemente han cometido suicidio,the other adult members of the expedition apparently have committed suicide,the other adult members of the expedition have apparently committed suicide,BLEU = 66.40 100.0/70.0/55.6/50.0 (BP = 1.000 ratio = 1.000 hyp_len = 11 ref_len = 11),0.9720527529716492,0.9759579263711495,4.88284158706665
789,789,common_voice_es_20063188.mp3,otras preparaciones incluyen un chorro de vino de jerez,the preparations and fruit acquire of the life of jerusalem,other preparations include a shot of sherry wine,BLEU = 4.99 20.0/5.6/3.1/1.8 (BP = 1.000 ratio = 1.250 hyp_len = 10 ref_len = 8),0.444696307182312,0.12195121951219512,2.9806787967681885
790,790,common_voice_es_19666556.mp3,se aplica a un tejido de prueba y se confecciona la prenda,is applied to a probational testament confesses the prince,they put it on testing fabric and make up a piece of clothing,BLEU = 3.06 11.1/6.2/3.6/2.1 (BP = 0.641 ratio = 0.692 hyp_len = 9 ref_len = 13),0.44109728932380676,0.03968253968253969,3.010931968688965
791,791,common_voice_es_19746690.mp3,posteriormente la orden será expropiada de sus tierras y rentas,later the order will be approved of its lands and rents,later on the order will be expropriated form their lands and rents,BLEU = 32.04 72.7/50.0/33.3/12.5 (BP = 0.913 ratio = 0.917 hyp_len = 11 ref_len = 12),0.6845654249191284,0.6545430672268908,3.912479877471924
792,792,common_voice_es_19953362.mp3,éste es el último y el más corto de los manuscritos,this is the last and most important of the manuscripts,this is the last and shortest manuscript,BLEU = 39.28 50.0/44.4/37.5/28.6 (BP = 1.000 ratio = 1.429 hyp_len = 10 ref_len = 7),0.7769734859466553,0.700152207001522,4.477391719818115
793,793,common_voice_es_19751292.mp3,hijo de juan ramón bernárdez y dolores filgueira,son of juan remon bernados and dolores filigara,son of juan ramon bernandez and dolores filgueira,BLEU = 25.85 62.5/42.9/16.7/10.0 (BP = 1.000 ratio = 1.000 hyp_len = 8 ref_len = 8),0.8599478602409363,0.605,4.12932014465332
794,794,common_voice_es_19637715.mp3,dispone de cámara termómetro y barómetro,the camera thermometer and barometer,it contains a camera a temperature sensor and a pressure sensor,BLEU = 3.83 40.0/12.5/8.3/6.2 (BP = 0.301 ratio = 0.455 hyp_len = 5 ref_len = 11),0.5878270268440247,0.09615384615384616,4.122593402862549
795,795,common_voice_es_19753820.mp3,diplomada en turismo,pomedentorum,she had a postgraduate diploma in tourism,BLEU = 0.00 0.0/0.0/0.0/0.0 (BP = 0.002 ratio = 0.143 hyp_len = 1 ref_len = 7),0.30306103825569153,0.0,2.602355480194092
796,796,common_voice_es_19610788.mp3,variante con el sistema de arma montado diferente de la anterior versión,perry and withal missus tomanns different from the interior version,with a system variant to assemble the weapon different from the previous version,BLEU = 12.43 40.0/22.2/12.5/7.1 (BP = 0.741 ratio = 0.769 hyp_len = 10 ref_len = 13),0.4327682554721832,0.2952755905511811,2.825413703918457
797,797,common_voice_es_19982857.mp3,el disco es grande,alban is great,the disk is big,BLEU = 19.72 33.3/25.0/25.0/0.0 (BP = 0.717 ratio = 0.750 hyp_len = 3 ref_len = 4),0.5364556908607483,0.48076923076923084,3.4153075218200684
798,798,common_voice_es_19639853.mp3,escudo heráldico en el primer campo de oro un roel de oro,scudder had a goal in the first field of war of a royal royal,heraldic emblem in the first field of gold a golden roundel,BLEU = 27.82 42.9/30.8/25.0/18.2 (BP = 1.000 ratio = 1.273 hyp_len = 14 ref_len = 11),0.43947455286979675,0.4977876106194691,2.6333181858062744
799,799,common_voice_es_18665843.mp3,¡ no hay huevos,no no,there are no eggs,BLEU = 18.39 50.0/50.0/0.0/0.0 (BP = 0.368 ratio = 0.500 hyp_len = 2 ref_len = 4),0.40159618854522705,0.13157894736842105,2.811044454574585
800,800,common_voice_es_20007730.mp3,contribuye al soporte lateral del pie,he contributed to the lateral support of the pie,supports the foots lateral base,BLEU = 5.67 22.2/6.2/3.6/2.1 (BP = 1.000 ratio = 1.800 hyp_len = 9 ref_len = 5),0.6298143863677979,0.2777777777777778,3.890028953552246
801,801,common_voice_es_19719501.mp3,fue una de las primeras pistas compuestas para el álbum,was one of the first pieces made for the album,this was one of the albums first composed tracks,BLEU = 27.78 50.0/33.3/25.0/14.3 (BP = 1.000 ratio = 1.111 hyp_len = 10 ref_len = 9),0.8357262015342712,0.618131868131868,4.010497093200684
802,802,common_voice_es_19724679.mp3,originalmente hirsch propuso que h dependía linealmente de los años que se llevara investigando,originally hirsch proposed that it should depend on the nearly of the years that he would be investigating,originally hirsch suggested that h would depend straightly on the number of years that the investigation had been carried out,BLEU = 7.75 61.1/17.6/3.1/1.7 (BP = 0.895 ratio = 0.900 hyp_len = 18 ref_len = 20),0.7718592882156372,0.47821969696969696,3.7890172004699707
803,803,common_voice_es_19605149.mp3,se encuentra frente a las costas de madagascar,in front of the coast of madagascar,it is located in front of the coasts of madagascar,BLEU = 31.85 85.7/66.7/40.0/25.0 (BP = 0.651 ratio = 0.700 hyp_len = 7 ref_len = 10),0.8876038193702698,0.7205975173574584,4.340405464172363
804,804,common_voice_es_19141133.mp3,es una de las villas históricas más visitadas de inglaterra,is one of the most respected cities of england,it is one of the historic villas more visited in england,BLEU = 25.27 55.6/37.5/28.6/16.7 (BP = 0.801 ratio = 0.818 hyp_len = 9 ref_len = 11),0.7764114737510681,0.3444444444444445,3.7255570888519287
805,805,common_voice_es_19655353.mp3,prensa gráfica acabaría llegando a acaparar el mercado de las publicaciones ilustradas,the graphic prints he ended up getting to the market and the illustrated publications,prensa grafica would end up cornering the market of illustrated publications,BLEU = 8.49 35.7/15.4/4.2/2.3 (BP = 1.000 ratio = 1.273 hyp_len = 14 ref_len = 11),0.5361021161079407,0.45231071779744353,3.8835561275482178
806,806,common_voice_es_19608201.mp3,en la iglesia primitiva sólo estaba permitida la predicación de los obispos,primitive church only it was permitted for the predictation of the abyss,in the primitive church only the bishops were authorized to preach,BLEU = 14.32 41.7/18.2/10.0/5.6 (BP = 1.000 ratio = 1.091 hyp_len = 12 ref_len = 11),0.46400249004364014,0.40180180180180186,3.593806266784668
807,807,common_voice_es_20002683.mp3,era hermano del capitán thomas lumley,he was the brother of the capsule,he was captain thomas lumleys brother,BLEU = 14.54 42.9/16.7/10.0/6.2 (BP = 1.000 ratio = 1.167 hyp_len = 7 ref_len = 6),0.47284331917762756,0.4189435336976321,3.032407283782959
808,808,common_voice_es_19720176.mp3,polidoro fue un dibujante compulsivo,polida was a difficult and compulsive guide,polidoro was a compulsive drawer,BLEU = 14.54 42.9/16.7/10.0/6.2 (BP = 1.000 ratio = 1.400 hyp_len = 7 ref_len = 5),0.6842527389526367,0.49145299145299143,3.7708728313446045
809,809,common_voice_es_19350147.mp3,un viejo enemigo de shinya y el blanco de su venganza,friend of censure in the height of his enchantment,an old enemy of shinya and the target of his revenge,BLEU = 9.08 44.4/12.5/7.1/4.2 (BP = 0.801 ratio = 0.818 hyp_len = 9 ref_len = 11),0.4799242317676544,0.29224537037037035,2.705047607421875
810,810,common_voice_es_19520544.mp3,se identifica a satanás como el ángel caído que se rebeló contra dios,it was identified as such as the angel cador which rebelled against you,satan is identified as the fallen angel who rebelled against god,BLEU = 10.70 46.2/25.0/4.5/2.5 (BP = 1.000 ratio = 1.182 hyp_len = 13 ref_len = 11),0.625582218170166,0.45634920634920634,3.577874183654785
811,811,common_voice_es_19627931.mp3,su obra periodística va de la mano con el humor,his pleiadistic cork was bad of the man with loneliness,his journalistic work its linked to humor,BLEU = 4.20 10.0/5.6/3.1/1.8 (BP = 1.000 ratio = 1.429 hyp_len = 10 ref_len = 7),0.4093628525733948,0.0684931506849315,2.4104042053222656
812,812,common_voice_es_18499975.mp3,a esa gente a veinte metros de su barco,its this agent twenty meters from here,those people at twenty meters from their ship,BLEU = 21.19 42.9/33.3/20.0/12.5 (BP = 0.867 ratio = 0.875 hyp_len = 7 ref_len = 8),0.5178374648094177,0.3727144866385373,3.234783411026001
813,813,common_voice_es_19634876.mp3,se puede sustituir el calabacín por la berenjena,can be substituted for the carbons for the behringenna,zucchini can be replaced with eggplant,BLEU = 9.54 22.2/12.5/7.1/4.2 (BP = 1.000 ratio = 1.500 hyp_len = 9 ref_len = 6),0.4075683057308197,0.29761904761904767,2.8724052906036377
814,814,common_voice_es_19667428.mp3,éste se transformó en una montaña con un agujero en el centro,was transformed into a mountain with a farm in the centre,it was transformed into a mountain with a hole in the center,BLEU = 57.67 81.8/70.0/55.6/50.0 (BP = 0.913 ratio = 0.917 hyp_len = 11 ref_len = 12),0.7932794094085693,0.7521527129370266,3.957874059677124
815,815,common_voice_es_19813706.mp3,empresaria agrícola,agricola empress,a agricultural businesswoman,BLEU = 0.00 0.0/0.0/0.0/0.0 (BP = 0.607 ratio = 0.667 hyp_len = 2 ref_len = 3),0.4618285000324249,0.0,3.671590566635132
816,816,common_voice_es_19674725.mp3,los filósofos de la antigua grecia intentaron demostrar un orden en la naturaleza,the philosophers of the anti grecian were trying to demonstrate the order of nature,the philosophers of ancient greece tried to proof there is order in nature,BLEU = 12.57 42.9/15.4/8.3/4.5 (BP = 1.000 ratio = 1.077 hyp_len = 14 ref_len = 13),0.7710789442062378,0.36610063872877396,4.509800910949707
817,817,common_voice_es_19993460.mp3,es nativo desde afganistán hasta japón e indochina,she is native from afghanistan to japan and indo china,he is found from afghanistan to japan and indochina,BLEU = 41.11 60.0/44.4/37.5/28.6 (BP = 1.000 ratio = 1.111 hyp_len = 10 ref_len = 9),0.8455527424812317,0.647130647130647,4.747243881225586
818,818,common_voice_es_18917596.mp3,maria decidió ser voluntaria estas navidades,for he had decided to be a volunteer in these navies,maria decided to volunteer this christmas,BLEU = 8.30 27.3/10.0/5.6/3.1 (BP = 1.000 ratio = 1.833 hyp_len = 11 ref_len = 6),0.5437980890274048,0.3931623931623932,3.2763733863830566
819,819,common_voice_es_19597703.mp3,el primer par actúa sobre el yugo y el segundo directamente sobre el espejo,the first part acts on the game and the second directly on the species,the first pair acts on the yoke and the second pair acts directly on the mirror,BLEU = 22.83 78.6/53.8/25.0/4.5 (BP = 0.867 ratio = 0.875 hyp_len = 14 ref_len = 16),0.6215419769287109,0.6635108274924155,3.61017107963562
820,820,common_voice_es_20021847.mp3,tras permanecer oculto varios días sus soldados lo llevaron a tucumán en una camilla,after a long time his soldiers took him to tikumen in the camp,the soldiers took him to tucuman on a stretcher after being hidden for several days,BLEU = 19.07 53.8/25.0/18.2/10.0 (BP = 0.857 ratio = 0.867 hyp_len = 13 ref_len = 15),0.6429665684700012,0.42884721456150027,3.492354154586792
821,821,common_voice_es_19616586.mp3,este es el segundo rescate que se realiza de esta protoraza,this is the second rescript that is made of this program,this is the second rescue that has been done of this proto race,BLEU = 24.18 63.6/40.0/22.2/12.5 (BP = 0.834 ratio = 0.846 hyp_len = 11 ref_len = 13),0.6188241839408875,0.4472257653061224,3.4263408184051514
822,822,common_voice_es_19770001.mp3,esta ruta es parte de sistema de autovías y vías expresas de california,it is part of the autobiography system and vistas of california,this route is part of the california expressway and expressway system,BLEU = 26.99 63.6/30.0/22.2/12.5 (BP = 1.000 ratio = 1.000 hyp_len = 11 ref_len = 11),0.4928262531757355,0.4359925788497217,3.3983938694000244
823,823,common_voice_es_19622616.mp3,una bancarrota y la venta de las existencias almacenadas en el local de st,why in creation an event of our misunderstandings in this,bankruptcy and the sale of the stored stock in the st store,BLEU = 4.09 20.0/5.6/3.1/1.8 (BP = 0.819 ratio = 0.833 hyp_len = 10 ref_len = 12),0.38309696316719055,0.0847457627118644,2.3401708602905273
824,824,common_voice_es_19609135.mp3,en concreto se han identificado cuatro especies,concrete for species identify,more precisely four species were identified,BLEU = 9.69 25.0/16.7/12.5/12.5 (BP = 0.607 ratio = 0.667 hyp_len = 4 ref_len = 6),0.657305896282196,0.17241379310344826,3.66024112701416
