,Unnamed: 0,path,source_text,pred_text,ref_text,ASR_BLEU,COMET,METEOR,BLASER
448,448,common_voice_es_19816848.mp3,nació en la habana cuba,he was born in the lavana of huba,they were born in havana cuba,BLEU = 11.04 25.0/14.3/8.3/5.0 (BP = 1.000 ratio = 1.333 hyp_len = 8 ref_len = 6),0.5732988715171814,0.30241935483870974,3.498234748840332
449,449,common_voice_es_19999431.mp3,la cabecera del departamento fue casablanca,the department gave us a white house,the departments capital was casablanca,BLEU = 6.57 14.3/8.3/5.0/3.1 (BP = 1.000 ratio = 1.400 hyp_len = 7 ref_len = 5),0.5456743240356445,0.3605769230769231,3.3590643405914307
450,450,common_voice_es_19770068.mp3,no tengas miedo,and the banker,dont be afraid,BLEU = 0.00 0.0/0.0/0.0/0.0 (BP = 1.000 ratio = 1.000 hyp_len = 3 ref_len = 3),0.43364596366882324,0.0,2.742648124694824
451,451,common_voice_es_19284430.mp3,nació en riad,he was born and reared,he was born in riad,BLEU = 39.76 60.0/50.0/33.3/25.0 (BP = 1.000 ratio = 1.000 hyp_len = 5 ref_len = 5),0.5063035488128662,0.5888888888888889,3.2541792392730713
452,452,common_voice_es_19651512.mp3,esta estación está situada enfrente del estadio azteca,his station is located in front of his audience,this station is located in front of the aztec stadium,BLEU = 52.56 66.7/62.5/57.1/50.0 (BP = 0.895 ratio = 0.900 hyp_len = 9 ref_len = 10),0.6386442184448242,0.6046576879910214,3.4079270362854004
453,453,common_voice_es_19175801.mp3,todos ellos forman parte de un viaje reflexivo y revelador,all of them are part of reflexive and rebellion,all of them are part of a reflexive and revealing journey,BLEU = 52.90 88.9/75.0/57.1/50.0 (BP = 0.801 ratio = 0.818 hyp_len = 9 ref_len = 11),0.685497522354126,0.7349537037037036,3.6289353370666504
454,454,common_voice_es_19596001.mp3,sin embargo todo cambia radicalmente cuando aparece en su escuela una joven vagabunda,however every thing comes radically when it appears in the school of edinburgh,however everything changes radically when a young vagabond shows up at his school,BLEU = 7.35 30.8/8.3/4.5/2.5 (BP = 1.000 ratio = 1.000 hyp_len = 13 ref_len = 13),0.5716709494590759,0.24278846153846156,2.8148722648620605
455,455,common_voice_es_19222424.mp3,su protagonismo varia dependiendo de las novelas,his protagonism varies depending on the novel,his protagonist varies depending on the soap opera,BLEU = 37.68 71.4/50.0/40.0/25.0 (BP = 0.867 ratio = 0.875 hyp_len = 7 ref_len = 8),0.8706393241882324,0.6126582278481013,4.521456241607666
456,456,common_voice_es_19684421.mp3,el reinado de cashel según antiguas fuentes de munster p ej,the rhine of cassel according to the ancient people of antioch,the kingdom of cashel according to ancient resources of munster for example,BLEU = 9.01 54.5/10.0/5.6/3.1 (BP = 0.913 ratio = 0.917 hyp_len = 11 ref_len = 12),0.6053758859634399,0.35830999066293184,3.446092128753662
457,457,common_voice_es_19686876.mp3,igualmente hay democracias buenas y malas,apparently they were given by democracies,in any case there are good as well as bad democracies,BLEU = 3.53 16.7/10.0/6.2/4.2 (BP = 0.435 ratio = 0.545 hyp_len = 6 ref_len = 11),0.5289589166641235,0.04761904761904762,3.0705366134643555
458,458,common_voice_es_19697383.mp3,al final es vencida por la reacción de cariño de tomoki hacia ella,at the end it is visited by the action of querino of timocris,she is finally defeated by tomokis loving reaction towards her,BLEU = 3.67 15.4/4.2/2.3/1.2 (BP = 1.000 ratio = 1.300 hyp_len = 13 ref_len = 10),0.43857160210609436,0.09708737864077671,2.900712728500366
459,459,common_voice_es_20022158.mp3,la población genera anticipaba que esta elección no sería justa,the general population anticipated that this election would not be just,the general population anticipated that these elections would not be fair,BLEU = 46.92 72.7/60.0/44.4/25.0 (BP = 1.000 ratio = 1.000 hyp_len = 11 ref_len = 11),0.803846001625061,0.9054545454545455,4.307890892028809
460,460,common_voice_es_19948047.mp3,se comenzó a trabajar inmediatamente y sus primeros habitantes llegaron desde el primer año,he started working immediately and the first inhabitants arrived from the first year,works were initiated immediately and their first inhabitants arrived as from the first year,BLEU = 28.86 69.2/50.0/27.3/10.0 (BP = 0.926 ratio = 0.929 hyp_len = 13 ref_len = 14),0.8992689251899719,0.6964028776978417,4.623219966888428
461,461,common_voice_es_18721402.mp3,porque te quiero,because i want you,because i love you,BLEU = 35.36 75.0/33.3/25.0/25.0 (BP = 1.000 ratio = 1.000 hyp_len = 4 ref_len = 4),0.937237560749054,0.6388888888888888,3.8980610370635986
462,462,common_voice_es_19122350.mp3,la película fue directamente para video no llegándose a estrenar en ningún cine,the movie was directly directed to villiers it didnt take place in any scene,the movie was directly for video not been able to debut in a movie theater,BLEU = 18.32 42.9/23.1/16.7/9.1 (BP = 0.931 ratio = 0.933 hyp_len = 14 ref_len = 15),0.4748721718788147,0.2861670395227443,3.2973785400390625
463,463,common_voice_es_19159423.mp3,iglesia de la purificación de nuestra señora,church of our lord,our lady of purification church,BLEU = 16.37 75.0/16.7/12.5/12.5 (BP = 0.779 ratio = 0.800 hyp_len = 4 ref_len = 5),0.6203204989433289,0.3061224489795918,3.612764835357666
464,464,common_voice_es_19009612.mp3,capítulo seis,at six,chapter six,BLEU = 50.00 50.0/50.0/0.0/0.0 (BP = 1.000 ratio = 1.000 hyp_len = 2 ref_len = 2),0.642733633518219,0.25,3.579127788543701
465,465,common_voice_es_19610985.mp3,en los sucesivos días continuarían atacando a las fuerzas gubernamentales y ocupando diferentes poblaciones,in the successive days they would continue attacking government forces and occupying different positions,they continued the attack on the government forces in the following days and occupied different populations,BLEU = 8.28 57.1/15.4/4.2/2.3 (BP = 0.867 ratio = 0.875 hyp_len = 14 ref_len = 16),0.8182283043861389,0.6064964954493147,4.7598419189453125
466,466,common_voice_es_18588315.mp3,un vino de españa,juan of spain,a wine from spain,BLEU = 19.72 33.3/25.0/25.0/0.0 (BP = 0.717 ratio = 0.750 hyp_len = 3 ref_len = 4),0.6661520004272461,0.12820512820512822,3.539903163909912
467,467,common_voice_es_19657978.mp3,se construyó con una nave central y un ábside cuadrado,it was built with a central nave and a square nave,the floor plan included a central aisle and a square apse,BLEU = 17.54 45.5/30.0/11.1/6.2 (BP = 1.000 ratio = 1.000 hyp_len = 11 ref_len = 11),0.6635473370552063,0.44,4.3087286949157715
468,468,common_voice_es_19596870.mp3,debido a esta estancia landers habla ruso de forma fluida,in addition to this flanders had to use fluid form,due to this instance landers speaks russian in a fluid way,BLEU = 9.03 40.0/11.1/6.2/3.6 (BP = 0.905 ratio = 0.909 hyp_len = 10 ref_len = 11),0.5497847199440002,0.1834862385321101,3.196667432785034
469,469,common_voice_es_18332483.mp3,¿ estamos desbordados con los nuevos y me pide un picadero ,we are disported with the new ones and have a picker,we are outpouring with the new people and he asks me a riding school,BLEU = 14.53 63.6/30.0/11.1/6.2 (BP = 0.761 ratio = 0.786 hyp_len = 11 ref_len = 14),0.4605158865451813,0.4632802025919856,2.971365451812744
470,470,common_voice_es_19170726.mp3,está ubicado en el área norte del distrito sur delimitado por el bv,it is located in the north northeast area of the south limited,it is located on the same are of the south district delimited by b v,BLEU = 17.16 58.3/36.4/20.0/5.6 (BP = 0.779 ratio = 0.800 hyp_len = 12 ref_len = 15),0.601791501045227,0.4574482854366237,3.6278417110443115
471,471,common_voice_es_19638607.mp3,se conservan tres relaciones de miembros de la orden de la banda,there are free relations of members of the order of the band,we keep three accounts by members of the order of the band,BLEU = 51.57 58.3/54.5/50.0/44.4 (BP = 1.000 ratio = 1.000 hyp_len = 12 ref_len = 12),0.7069380879402161,0.5824829931972789,4.090371131896973
472,472,common_voice_es_19712927.mp3,variados intentos de restauración no han dado frutos,various restaurants in tents have not had fruit,several restoration attempts were made but none of them were successful,BLEU = 0.00 0.0/0.0/0.0/0.0 (BP = 0.687 ratio = 0.727 hyp_len = 8 ref_len = 11),0.4330732524394989,0.0,3.351839542388916
473,473,common_voice_es_19745493.mp3,esta obra la compró paul signac,this work is written by wolsey,paul signac bought this work,BLEU = 16.23 33.3/20.0/12.5/8.3 (BP = 1.000 ratio = 1.200 hyp_len = 6 ref_len = 5),0.6262328028678894,0.36764705882352944,3.0443921089172363
474,474,common_voice_es_18933465.mp3,necesito reparar mis impulsores turbo,i had to prepare my impulsive turn,i need to fix my turbo impellers,BLEU = 8.64 42.9/8.3/5.0/3.1 (BP = 1.000 ratio = 1.000 hyp_len = 7 ref_len = 7),0.547188937664032,0.2142857142857143,3.3139114379882812
475,475,common_voice_es_19630053.mp3,con este filme alterio retornó al cine argentino luego de su exilio en españa,this film hortense returned to the argentine in sight of spains exile,with this movie alterio returned to the argentinian cinema after his exile in spain,BLEU = 12.69 50.0/18.2/10.0/5.6 (BP = 0.846 ratio = 0.857 hyp_len = 12 ref_len = 14),0.6227896809577942,0.4574275362318841,3.430100202560425
476,476,common_voice_es_19698042.mp3,ha sido certificado platino desde entonces,he has been certified at platina since then,since then it has been platinum certified,BLEU = 16.52 62.5/28.6/8.3/5.0 (BP = 1.000 ratio = 1.143 hyp_len = 8 ref_len = 7),0.8608209490776062,0.6281690140845071,4.424144744873047
477,477,common_voice_es_19964209.mp3,don juan de la cruz gómez murillo se encarga de la producción de ron,one day larchers gambler marius takes the production over,responsible for the rum manufacturing we have mr juan de la cruz gomez murillo,BLEU = 2.74 11.1/6.2/3.6/2.1 (BP = 0.574 ratio = 0.643 hyp_len = 9 ref_len = 14),0.4581560790538788,0.07407407407407407,2.629451274871826
478,478,common_voice_es_19654121.mp3,el siguiente diagrama muestra a las localidades más próximas a galena,the following diagram shows the largest circle in localities,the following chart shows the towns nearest to galena,BLEU = 13.49 44.4/25.0/7.1/4.2 (BP = 1.000 ratio = 1.000 hyp_len = 9 ref_len = 9),0.5690611004829407,0.41666666666666663,3.6171653270721436
479,479,common_voice_es_18833868.mp3,me acometió tal tentación de risa que por poco me ahogo,got so much attention that i didnt see anything,i laughed so much that i almost choke myself,BLEU = 13.49 44.4/25.0/7.1/4.2 (BP = 1.000 ratio = 1.000 hyp_len = 9 ref_len = 9),0.4855167269706726,0.41666666666666663,2.725034475326538
480,480,common_voice_es_18364996.mp3,amigo de muchos amigo de ninguno,he grew up of many he grew up in no one,friend of many friend of none,BLEU = 7.50 18.2/10.0/5.6/3.1 (BP = 1.000 ratio = 1.833 hyp_len = 11 ref_len = 6),0.4639224708080292,0.15384615384615385,3.0656025409698486
481,481,common_voice_es_19139865.mp3,el sistema tierraluna es el caso mejor estudiado,the lunar system is the best study,the earth moon system is the case which has been best studied,BLEU = 13.60 71.4/33.3/20.0/12.5 (BP = 0.490 ratio = 0.583 hyp_len = 7 ref_len = 12),0.8075266480445862,0.4891304347826087,3.913316488265991
482,482,common_voice_es_19791808.mp3,sin embargo dicha área geográfica ha cambiado en el transcurso del tiempo,however this geographic area has changed in the course of time,this geographical area has however changed in the course of time,BLEU = 54.91 90.9/60.0/44.4/37.5 (BP = 1.000 ratio = 1.000 hyp_len = 11 ref_len = 11),0.9565025568008423,0.9898572501878287,4.892922878265381
483,483,common_voice_es_19609696.mp3,en estos estudios siempre se consideró la interacción entre indígenas y mestizos o ladinos,in these studies they always considered the interaction between imbigenezza and messelsozo lardino,in these studies the interaction between indigenous and mixed raced or ladinos was always taken into account,BLEU = 15.28 61.5/33.3/18.2/5.0 (BP = 0.735 ratio = 0.765 hyp_len = 13 ref_len = 17),0.4695606529712677,0.4518072289156627,3.274306297302246
484,484,common_voice_es_19596888.mp3,desde ahí puede abrir fuego y lanzar granadas,since then he was able to open the door and slam the doors of the long room,from that point they can open fire a throw grenades,BLEU = 2.29 5.9/3.1/1.7/0.9 (BP = 1.000 ratio = 1.700 hyp_len = 17 ref_len = 10),0.49745991826057434,0.04672897196261682,2.868366003036499
485,485,common_voice_es_18956990.mp3,a las cosas que no ve que es normal,for the things that i dont see its normal,what they dont see its normal,BLEU = 29.85 44.4/37.5/28.6/16.7 (BP = 1.000 ratio = 1.500 hyp_len = 9 ref_len = 6),0.8243832588195801,0.6299603174603176,4.042588710784912
486,486,common_voice_es_20005377.mp3,george grote fue el hijo mayor de este matrimonio,horace grove was the best son of his marriage,george grote was the oldest son of this marriage,BLEU = 14.26 55.6/25.0/7.1/4.2 (BP = 1.000 ratio = 1.000 hyp_len = 9 ref_len = 9),0.6709066033363342,0.4955555555555556,3.2542035579681396
487,487,common_voice_es_19746014.mp3,su mano deforme era tan peculiar que los aficionados le reconocían por ella,his manner of form was very peculiar that the children might guess for her,they had such a peculiar deformed hand that the fans recognized them because of that,BLEU = 6.29 28.6/7.7/4.2/2.3 (BP = 0.931 ratio = 0.933 hyp_len = 14 ref_len = 15),0.5712824463844299,0.1342281879194631,3.377753973007202
488,488,common_voice_es_18770216.mp3,con la tormenta no pasa nada que puedo mantener el rumbo,the storm it doesnt happen you can maintain the room,with the storm nothing happens i can stay the course,BLEU = 9.98 40.0/11.1/6.2/3.6 (BP = 1.000 ratio = 1.000 hyp_len = 10 ref_len = 10),0.640751838684082,0.372,3.369781732559204
489,489,common_voice_es_19628768.mp3,el producto no pudo capturar el mercado pero todavía está disponible en algunos supermercados,i can capture in the market but it is already available in some other markets,the product could not position in the market however it is still available in some supermarkets,BLEU = 17.49 53.3/35.7/15.4/4.2 (BP = 0.936 ratio = 0.938 hyp_len = 15 ref_len = 16),0.6396906971931458,0.4898781446540881,3.7830162048339844
490,490,common_voice_es_19635969.mp3,milan y lazio tercero y cuarto respectivamente fueron admitidos en la fase preliminar,guillaume lozier third and fourth respectively were admitted in the preliminary case,milan and lazio ranking third and fourth respectively were accepted into the preliminary phase,BLEU = 30.87 58.3/45.5/30.0/22.2 (BP = 0.846 ratio = 0.857 hyp_len = 12 ref_len = 14),0.6835110783576965,0.5751811594202899,3.832451105117798
491,491,common_voice_es_19768684.mp3,así como se caracteriza por el mayor movimiento comercial de toda la ciudad,thus it is characterized by the major commercial movement of the city,its characterized for offering the highest commercial traffic in the whole city,BLEU = 5.06 41.7/4.5/2.5/1.4 (BP = 1.000 ratio = 1.000 hyp_len = 12 ref_len = 12),0.7843738198280334,0.25,4.433941841125488
492,492,common_voice_es_19605959.mp3,desde que se retiró como jugador se convirtió en entrenador,thenceforward as a player he became a coach,since he retired as player he became a coach,BLEU = 47.75 75.0/57.1/50.0/40.0 (BP = 0.882 ratio = 0.889 hyp_len = 8 ref_len = 9),0.6198283433914185,0.66167290886392,4.1038031578063965
493,493,common_voice_es_19139014.mp3,blank y jones actúan en festivales principales en alemania países bajos polonia y rusia,jack and john zach had made festivals in germany bodgers polonia and asia,blank and jones perform in the main festivals in germany netherlands poland and russia,BLEU = 12.10 38.5/16.7/9.1/5.0 (BP = 0.926 ratio = 0.929 hyp_len = 13 ref_len = 14),0.7123278379440308,0.320863309352518,3.1723320484161377
494,494,common_voice_es_19673221.mp3,se han hecho todos los esfuerzos por mantenerlo estable y rápido,they have left all their efforts to maintain a stable and rapid,all efforts have been made to keep the file system stable and fast,BLEU = 8.20 50.0/9.1/5.0/2.8 (BP = 0.920 ratio = 0.923 hyp_len = 12 ref_len = 13),0.5676535964012146,0.44375889890840053,4.1763129234313965
495,495,common_voice_es_19622687.mp3,la iglesia parroquial fue en sus orígenes una construcción modesta,parish church was in its origin a modest construction,initially the parish church was a humble establishment,BLEU = 19.07 44.4/25.0/14.3/8.3 (BP = 1.000 ratio = 1.125 hyp_len = 9 ref_len = 8),0.8181944489479065,0.46296296296296297,4.9568071365356445
496,496,common_voice_es_19124156.mp3,desapareció tras retirarle su patrocinio la generalidad valenciana,he disappeared after retiring his patron saint in a valencian generality,he disappeared after the valencian government took away their patronage,BLEU = 14.99 36.4/20.0/11.1/6.2 (BP = 1.000 ratio = 1.100 hyp_len = 11 ref_len = 10),0.5710372924804688,0.37128712871287134,4.1212544441223145
497,497,common_voice_es_19711406.mp3,no hubo nuevos integrantes de la primera división ya que los descensos estaban suspendidos,there were no new integrants of the primary division and the expensive years were suspended,there were no new members of the premier league since relegations have been suspended,BLEU = 20.33 46.7/28.6/15.4/8.3 (BP = 1.000 ratio = 1.071 hyp_len = 15 ref_len = 14),0.5874489545822144,0.3401360544217687,3.6938374042510986
498,498,common_voice_es_19687794.mp3,se encuentra en áfrica lago tanganika,is located in africa ten canadian,found in africa lake tanganyika,BLEU = 16.23 33.3/20.0/12.5/8.3 (BP = 1.000 ratio = 1.200 hyp_len = 6 ref_len = 5),0.5553815364837646,0.36764705882352944,3.1860454082489014
499,499,common_voice_es_19733528.mp3,la mayor diferencia entre ambos es el ámbito,the difference between both is the environment,the biggest difference between them is the context,BLEU = 17.03 71.4/33.3/10.0/6.2 (BP = 0.867 ratio = 0.875 hyp_len = 7 ref_len = 8),0.8136454224586487,0.5645569620253165,4.1958112716674805
500,500,common_voice_es_19639771.mp3,temas del día de la cero discriminación,a day of discrimination,zero discrimination day topics,BLEU = 19.00 50.0/16.7/12.5/12.5 (BP = 1.000 ratio = 1.000 hyp_len = 4 ref_len = 4),0.7224146127700806,0.25,3.666642189025879
501,501,common_voice_es_19634439.mp3,este parque tiene atractivos tanto históricos como naturales,as many historical attractions as natural,there are both historical and natural attractions in this park,BLEU = 5.48 50.0/10.0/6.2/4.2 (BP = 0.513 ratio = 0.600 hyp_len = 6 ref_len = 10),0.6412820219993591,0.15625,3.8653552532196045
502,502,common_voice_es_19629872.mp3,necesitamos uno por siglo creo que esa es la regla,we need a sign i think that is the rule,we need one per century i think that is the rule,BLEU = 52.61 80.0/66.7/50.0/42.9 (BP = 0.905 ratio = 0.909 hyp_len = 10 ref_len = 11),0.7181581854820251,0.7282110091743119,3.896662950515747
503,503,common_voice_es_19724585.mp3,comenzó a nadar desde los cinco años de edad,he started to die for the five years of his life,he started swimming when he was five years old,BLEU = 10.60 36.4/20.0/5.6/3.1 (BP = 1.000 ratio = 1.222 hyp_len = 11 ref_len = 9),0.42667514085769653,0.34307065217391297,3.4834868907928467
504,504,common_voice_es_19663553.mp3,es ahora considerada la raza más rara del perro calvo,it is now considered the most drear race of peru,it is nowadays considered to be the most weird breed of the hairless dogs,BLEU = 8.80 60.0/22.2/6.2/3.6 (BP = 0.670 ratio = 0.714 hyp_len = 10 ref_len = 14),0.5439151525497437,0.31352124183006536,3.5152459144592285
505,505,common_voice_es_18338594.mp3,si no hay otra cosa que podamos hacer ,there is another thing we can do,it theres nothing we can do,BLEU = 24.45 42.9/33.3/20.0/12.5 (BP = 1.000 ratio = 1.167 hyp_len = 7 ref_len = 6),0.7383669018745422,0.6147540983606558,4.031145095825195
506,506,common_voice_es_19749839.mp3,lo que más le gusta sintetizar es comida,the more i like to synthesize its the better,he likes to synthesize food mostly,BLEU = 9.54 22.2/12.5/7.1/4.2 (BP = 1.000 ratio = 1.500 hyp_len = 9 ref_len = 6),0.5683031678199768,0.46737213403880074,3.4462664127349854
507,507,common_voice_es_19611082.mp3,bob se quedó prendado de esta marca que apostaba por un estilo punk rock,help me to this mark which was posted by pencroft,bob got attached to this label that was going for a punk rock style,BLEU = 6.23 30.0/11.1/6.2/3.6 (BP = 0.670 ratio = 0.714 hyp_len = 10 ref_len = 14),0.410770446062088,0.275735294117647,2.8232791423797607
508,508,common_voice_es_19699945.mp3,cipselas de color verde pálido a bronceado,sips of red and pale yellow,pale green to bronze colored cypselae,BLEU = 8.12 16.7/10.0/6.2/4.2 (BP = 1.000 ratio = 1.000 hyp_len = 6 ref_len = 6),0.46736323833465576,0.08333333333333333,3.5873634815216064
509,509,common_voice_es_20026778.mp3,fuera del campo a los cinco minutos,the camp for five minutes,outside the field of action within five minutes,BLEU = 12.98 60.0/25.0/16.7/12.5 (BP = 0.549 ratio = 0.625 hyp_len = 5 ref_len = 8),0.5610029697418213,0.33189033189033185,3.7059457302093506
510,510,common_voice_es_19728800.mp3,las estaciones de radio le dedicaban la canción golpe traidor,the radio stations dedicated the sombrero trade,the radio stations dedicated the song traitorous blow to them,BLEU = 40.05 71.4/66.7/60.0/50.0 (BP = 0.651 ratio = 0.700 hyp_len = 7 ref_len = 10),0.5037972331047058,0.5134020618556702,2.990888833999634
511,511,common_voice_es_18634522.mp3,¿ no estamos oficialmente juntos,are we officially together,arent we officially together,BLEU = 59.46 75.0/66.7/50.0/50.0 (BP = 1.000 ratio = 1.000 hyp_len = 4 ref_len = 4),0.9507799744606018,0.7361111111111112,4.485415935516357
512,512,common_voice_es_19768519.mp3,huele similar al suero de leche y tiene un sabor ligeramente ácido,can be similar to the sweet water and it has a lighter air,it has a smell similar to whey and a slightly sour flavor,BLEU = 15.13 46.2/25.0/9.1/5.0 (BP = 1.000 ratio = 1.083 hyp_len = 13 ref_len = 12),0.5914426445960999,0.4224058769513315,3.5649003982543945
513,513,common_voice_es_19624101.mp3,en su casa ella comienza a preparar un poco de vodka en su taza,her house she starts preparing a little work in her house,at her home she starts to prepare some vodka on her mug,BLEU = 8.14 36.4/10.0/5.6/3.1 (BP = 0.913 ratio = 0.917 hyp_len = 11 ref_len = 12),0.48625919222831726,0.3126050420168068,3.270569324493408
514,514,common_voice_es_19744688.mp3,si no luchamos estamos perdidos,if we dont watch were lost,if we dont fight we are lost,BLEU = 27.48 66.7/40.0/25.0/16.7 (BP = 0.846 ratio = 0.857 hyp_len = 6 ref_len = 7),0.5933403968811035,0.2898550724637681,3.152529239654541
515,515,common_voice_es_19596878.mp3,es el concejo más occidental de los que pertenecen al municipio de vitoria,it is the most western part of the country that belongs to the victorian municipality,it is the most western advise from the ones that belong to the vitoria municipality,BLEU = 30.93 66.7/35.7/23.1/16.7 (BP = 1.000 ratio = 1.000 hyp_len = 15 ref_len = 15),0.6305733919143677,0.715702479338843,4.095022201538086
516,516,common_voice_es_18965980.mp3,no mires abajo al frente eso es ,i dont think ill try,do not look down in front thats it,BLEU = 0.00 0.0/0.0/0.0/0.0 (BP = 0.549 ratio = 0.625 hyp_len = 5 ref_len = 8),0.43119993805885315,0.0,3.0059521198272705
517,517,common_voice_es_19613583.mp3,sin embargo este deseo no logró funcionar,however this decision did not work,how ever this desire didnt work,BLEU = 9.65 33.3/10.0/6.2/4.2 (BP = 1.000 ratio = 1.000 hyp_len = 6 ref_len = 6),0.8273763060569763,0.16666666666666666,4.172292709350586
518,518,common_voice_es_19644837.mp3,sólo se completó una única unidad,a single unit was completed,only one unit was completed,BLEU = 39.76 60.0/50.0/33.3/25.0 (BP = 1.000 ratio = 1.000 hyp_len = 5 ref_len = 5),0.8978096842765808,0.5888888888888889,4.5212531089782715
519,519,common_voice_es_19766309.mp3,lo dispuesto en este presupuesto final se llevó a cabo,displacement in this final presupposito ended up in a bar,what was arranged on this final budget was carried out,BLEU = 8.39 20.0/11.1/6.2/3.6 (BP = 1.000 ratio = 1.000 hyp_len = 10 ref_len = 10),0.42268192768096924,0.18750000000000003,3.0316717624664307
520,520,common_voice_es_19728156.mp3,se refiere a las interacciones entre la política tecnología y cultura,they referred to interactions between politics technology and culture,it refers to the interactions between politics technology and culture,BLEU = 54.63 77.8/62.5/57.1/50.0 (BP = 0.895 ratio = 0.900 hyp_len = 9 ref_len = 10),0.9128477573394775,0.8017676767676769,4.801330089569092
521,521,common_voice_es_19667940.mp3,hill es frecuentemente descrito como un poeta difícil y exigente,hell is frequently described as a difficult and oxygen poor,hill is usually described as a difficult and tough poet,BLEU = 41.11 60.0/44.4/37.5/28.6 (BP = 1.000 ratio = 1.000 hyp_len = 10 ref_len = 10),0.6395615935325623,0.5888888888888889,3.4711084365844727
522,522,common_voice_es_19750861.mp3,carece de crestas verticales adicionales,he carries vertical crests,it lacks of additional vertical crests,BLEU = 19.38 50.0/33.3/25.0/25.0 (BP = 0.607 ratio = 0.667 hyp_len = 4 ref_len = 6),0.6468110084533691,0.32327586206896547,3.8136775493621826
523,523,common_voice_es_20093274.mp3,varias de sus novelas y relatos se desarrollan en dicha ciudad,various of his novels and relapses occur in each,several of his novels and short stories take place in that city,BLEU = 22.61 55.6/37.5/28.6/16.7 (BP = 0.717 ratio = 0.750 hyp_len = 9 ref_len = 12),0.6086141467094421,0.41367521367521376,3.7119810581207275
